{
  "active_change": null,
  "blockers": [],
  "current_stage": "start",
  "deferred_validation": [],
  "document_fingerprints": {
    "adr": null,
    "contracts": null,
    "design": null,
    "design.md": "f34527260553e615cc100ae2563af2ed9bad42ffbb8505d492fd09e800ce4a85",
    "diagrams": null,
    "proposal.md": null,
    "spec.md": "fc826d7bdd159b91405a18086896e5c61facf0a0f728254d871b93ca31e4eed6",
    "specs": "8c2a0aeef0722431a8c6a154fecddfe551e99ec6dbaaa44cd42ca8dfff05f005",
    "tasks.md": "6f9af7d90b491a0c8a05b055729c31849652ac5d78a57a079c847c8340759359",
    "test-plan.md": null
  },
  "documentation_convergence": "missing-or-stale",
  "evidence_gaps": [],
  "feature_review": "missing-or-stale",
  "feature_state": "awaiting-human-review",
  "layout_version": 2,
  "next_command": "/kapelle:start fast-complete-feature-artifacts --approve",
  "recovery_status": "native",
  "review_ready": false,
  "revision": null,
  "ship_ready": false,
  "slug": "fast-complete-feature-artifacts",
  "task_counts": {
    "implemented-unverified": 3,
    "total": 3
  },
  "tasks": {
    "BASE": "implemented-unverified",
    "W4": "implemented-unverified",
    "W5": "implemented-unverified"
  }
}
