{
  "active_change": null,
  "blockers": [],
  "current_stage": "start",
  "deferred_validation": [],
  "document_fingerprints": {
    "adr": null,
    "contracts": null,
    "design": null,
    "design.md": "20ba5a384a969fa1e5edfac0ff884388fc28236c0569515883f665212198d402",
    "diagrams": null,
    "proposal.md": "03ba6a462caaa05639f6a0cbd659b8c727e6545c8e93c3a6ab859113c1dcfecc",
    "spec.md": "d25b4ac7d212909cf3ca259cf4475c15082d35c1c59a122ad750bf1b3ab588bc",
    "specs": null,
    "tasks.md": "715247a022f9cdb3ec93ba86e20a33835e7a0c0ffcfc230e1890316a3fd081d0",
    "test-plan.md": "1c1400f5a12e0c57e6d25968745bf007ff6f2ec10d8e940d41033e74a90555ec"
  },
  "documentation_convergence": "missing-or-stale",
  "evidence_gaps": [],
  "feature_review": "missing-or-stale",
  "feature_state": "awaiting-human-review",
  "layout_version": 2,
  "next_command": "/kapelle:start human-readable-artifacts-refactor --revise",
  "recovery_status": "native",
  "review_ready": false,
  "revision": null,
  "ship_ready": false,
  "slug": "human-readable-artifacts-refactor",
  "task_counts": {
    "implemented-unverified": 9,
    "total": 9
  },
  "tasks": {
    "T01": "implemented-unverified",
    "T02": "implemented-unverified",
    "T03": "implemented-unverified",
    "T04": "implemented-unverified",
    "T05": "implemented-unverified",
    "T06": "implemented-unverified",
    "T07": "implemented-unverified",
    "T08": "implemented-unverified",
    "T09": "implemented-unverified"
  }
}
